{"schema_version":"1.0.0","case_id":"case-demo-20260927","network":"bitcoin-regtest","txid":"1111111111111111111111111111111111111111111111111111111111111111","vout":0,"amount_sats":125000,"script_id":"script:demo:001","script_type":"p2wpkh","address":"bcrt1qdemosynthetic001","source_refs":[{"evidence_id":"ev-demo-transactions","source_sha256":"0000000000000000000000000000000000000000000000000000000000000000","locator_type":"synthetic","locator":"output:0","byte_start":null,"byte_end":null}]}
